### ISSUE TITLE
Random timeouts from FTP data transfers

### ISSUE THREAD

**Issue by jb-boin** [Castaglia/proftpd-mod_proxy#130]
I compiled the module with ProFTPD 1.3.6-2 on Debian Stretch.
I use it as a reverse proxy with the backend retrieved from a MySQL database.

The connection to the backends (which are Pure-FTPDs on Debian Stretch and Jessie) work fine but it frequently hangs when trying to _LIST_, i have the same issue using FileZilla and ncftp as a client and connecting directly to the backends works fine.

The module debug trace of a listing that worked 2 or 3 times in a row :
```
2018-07-13 15:50:39,630 [1867] <proxy.ftp.ctrl:9>: proxied PASV command from frontend to backend
2018-07-13 15:50:39,631 [1867] <proxy.ftp.ctrl:9>: received '227 Entering Passive Mode (YYY,YYY,YYY,245,255,200)' response from backend to frontend
2018-07-13 15:50:39,631 [1867] <proxy.ftp.xfer:12>: obtained address YYY.YYY.YYY.245#65480 for passive data transfer
2018-07-13 15:50:39,631 [1867] <proxy.ftp.ctrl:9>: backend->frontend response: 227 Entering Passive Mode (XXX,XXX,XX,26,132,117).
2018-07-13 15:50:39,632 [1867] <proxy.ftp.ctrl:9>: proxied command 'MLSD /test/' from frontend to backend
2018-07-13 15:50:39,632 [1867] <proxy:17>: connecting to backend server for passive data transfer for MLSD
2018-07-13 15:50:39,633 [1867] <proxy.ftp.conn:9>: connecting to YYY.YYY.YYY.245#65480 from 195.144.11.26#21
2018-07-13 15:50:39,633 [1867] <proxy.ftp.conn:9>: connected to server 'YYY.YYY.YYY.245'
2018-07-13 15:50:39,633 [1867] <proxy.ftp.ctrl:9>: received '150 Accepted data connection' response from backend to frontend
2018-07-13 15:50:39,633 [1867] <proxy.ftp.ctrl:9>: backend->frontend response: 150 Accepted data connection
2018-07-13 15:50:39,633 [1867] <proxy:17>: accepting connection from frontend client for passive data transfer for MLSD
2018-07-13 15:50:39,633 [1867] <proxy.ftp.conn:9>: accepted connection from server 'XXX.XXX.XX.241'
2018-07-13 15:50:39,633 [1867] <proxy:19>: handling data connection during data transfer
2018-07-13 15:50:39,634 [1867] <proxy:19>: read EOF on data connection, closing frontend/backend data connections
2018-07-13 15:50:39,634 [1867] <proxy.ftp.ctrl:9>: received '226-Options: -a -l 
226 0 matches total' response from backend to frontend
2018-07-13 15:50:39,634 [1867] <proxy.ftp.ctrl:9>: backend->frontend response: 226-Options: -a -l 
226 0 matches total
```

Then just after, on the same connection, the same query hangs just after the _read EOF_ line :
```
2018-07-13 15:50:43,518 [1867] <proxy.ftp.ctrl:9>: proxied PASV command from frontend to backend
2018-07-13 15:50:43,518 [1867] <proxy.ftp.ctrl:9>: received '227 Entering Passive Mode (YYY,YYY,YYY,245,42,250)' response from backend to frontend
2018-07-13 15:50:43,518 [1867] <proxy.ftp.xfer:12>: obtained address YYY.YYY.YYY.245#11002 for passive data transfer
2018-07-13 15:50:43,518 [1867] <proxy.ftp.ctrl:9>: backend->frontend response: 227 Entering Passive Mode (XXX,XXX,XX,26,169,51).
2018-07-13 15:50:43,520 [1867] <proxy.ftp.ctrl:9>: proxied command 'MLSD /test/' from frontend to backend
2018-07-13 15:50:43,520 [1867] <proxy:17>: connecting to backend server for passive data transfer for MLSD
2018-07-13 15:50:43,520 [1867] <proxy.ftp.conn:9>: connecting to YYY.YYY.YYY.245#11002 from XXX.XXX.XX.26#21
2018-07-13 15:50:43,520 [1867] <proxy.ftp.conn:9>: connected to server 'YYY.YYY.YYY.245'
2018-07-13 15:50:43,520 [1867] <proxy.ftp.ctrl:9>: received '150 Accepted data connection' response from backend to frontend
2018-07-13 15:50:43,521 [1867] <proxy.ftp.ctrl:9>: backend->frontend response: 150 Accepted data connection
2018-07-13 15:50:43,521 [1867] <proxy:17>: accepting connection from frontend client for passive data transfer for MLSD
2018-07-13 15:50:43,521 [1867] <proxy.ftp.conn:9>: accepted connection from server 'XXX.XXX.XX.241'
2018-07-13 15:50:43,521 [1867] <proxy:19>: handling data connection during data transfer
2018-07-13 15:50:43,521 [1867] <proxy:19>: read EOF on data connection, closing frontend/backend data connections
```

Here is the proxy.log, when it hangs :
```
2018-07-13 15:50:43,518 mod_proxy/0.5[1867]: Entering Passive Mode (XXX,XXX,XX,26,169,51).
2018-07-13 15:50:43,521 mod_proxy/0.5[1867]: passive backend data connection opened - local  : XXX.XXX.XX.26:45463
2018-07-13 15:50:43,521 mod_proxy/0.5[1867]: passive backend data connection opened - remote : YYY.YYY.YYY.245:11002
2018-07-13 15:50:43,521 mod_proxy/0.5[1867]: passive frontend data connection opened - local  : XXX.XXX.XX.26:43315
2018-07-13 15:50:43,521 mod_proxy/0.5[1867]: passive frontend data connection opened - remote : XXX.XXX.XX.241:47773
2018-07-13 15:50:46,524 mod_proxy/0.5[1867]: timed out waiting for end-of-transfer response from backend server, terminating transfer
````

Also to note that i have those on the proftpd.log (the server is on a LXC container and setting _CapabilitiesEngine_ to any value doesnt solve it) :
```
2018-07-13 15:50:19,238 proxyftp1 proftpd[1867] XXX.XXX.XX.26 (XXX.XXX.XX.241[XXX.XXX.XX.241]): ROOT PRIVS: unable to seteuid(): Operation not permitted
2018-07-13 15:50:19,238 proxyftp1 proftpd[1867] XXX.XXX.XX.26 (XXX.XXX.XX.241[XXX.XXX.XX.241]): ROOT PRIVS: unable to setegid(): Operation not permitted
2018-07-13 15:50:19,238 proxyftp1 proftpd[1867] XXX.XXX.XX.26 (XXX.XXX.XX.241[XXX.XXX.XX.241]): RELINQUISH PRIVS: unable to seteuid(PR_ROOT_UID): Operation not permitted
2018-07-13 15:50:19,259 proxyftp1 proftpd[1867] XXX.XXX.XX.26 (XXX.XXX.XX.241[XXX.XXX.XX.241]): RELINQUISH PRIVS: unable to seteuid(PR_ROOT_UID): Operation not permitted
2018-07-13 15:50:19,260 proxyftp1 proftpd[1867] XXX.XXX.XX.26 (XXX.XXX.XX.241[XXX.XXX.XX.241]): mod_cap/1.1: setreuid(106, 0) failed: Operation not permitted
```

Here is the module configuration :
```
ProxyEngine On
ProxyTables /dev/shm/proftpd_mod_proxy
ProxyLog /var/log/proftpd/proxy.log
ProxyRole reverse
ProxyReverseConnectPolicy PerUser
ProxyOptions ShowFeatures
ProxyTLSEngine off
ProxyTLSVerifyServer off
ProxyReverseServers sql:/getBackend
SQLNamedQuery getBackend SELECT "CONCAT('ftp://', host) FROM ftp WHERE user = '%{0}'"
TraceLog /var/log/proftpd/trace.log
Trace proxy:20 proxy.ftp.conn:20 proxy.ftp.ctrl:20 proxy.ftp.data:20 proxy.ftp.msg:20 proxy.ftp.xfer:20
```

I tried every _ProxyDataTransferPolicy_ parameters without any success.

**Comment by jb-boin** [comment]
I disabled _ProxyOptions ShowFeatures_ and now i got this error after the timeout message on proxy.log :
```
2018-07-13 16:42:20,069 mod_proxy/0.5[2202]: received response code 226, but expected 227 for PASV command
2018-07-13 16:42:20,073 mod_proxy/0.5[2202]: unable to connect to YYY.YYY.YYY.245#21824: Connection refused
```

And here is what i got on ncftp with the debug mode on :
```
> ls -la /

ls caching not used because of ls flags: -a
Cmd: PASV
227: Entering Passive Mode (XXX,XXX,XX,26,129,155).
Cmd: LIST /
150: Accepted data connection
500: LIST: Connection timed out
List failed.
```

Then if i do another _ls -la_ just after having this error :
```
> ls -la /

ls caching not used because of ls flags: -a
Cmd: PASV
Cannot parse PASV response: Options: -a -l 
Cannot parse PASV response: Options: -a -l 
226: Options: -a -l 
     18 matches total
Cmd: LIST /
227: Entering Passive Mode (YYY,YYY,YYY,245,205,103)
```

Seems like the answer to the first _LIST /_ that hanged is returned ot the next command sent to the server (_PASV_).

**Comment by jb-boin** [comment]
Playing with tcpdump, it seems that the problem is between the client and the proxy.

After having sent `150 Accepted data connection` to the client, the proxy does not sends : 
```
226-Options: -a -l 
	226 20 matches total
```
Which has been received from the backend, then after 3 seconds it sends `500 LIST: Connection timed out`.


tcpdump between the backend (xxx.xxx.xx.190) and the proxy (xxx.xxx.xx.26) :
```tcpdump
17:07:39.287513 IP (tos 0x0, ttl 63, id 51597, offset 0, flags [DF], proto TCP (6), length 58)
    xxx.xxx.xx.26.46471 > xxx.xxx.xx.190.21: Flags [P.], cksum 0x7954 (correct), seq 252:258, ack 2371, win 127, options [nop,nop,TS val 3675220555 ecr 501694449], length 6: FTP, length: 6
	PASV
17:07:39.287639 IP (tos 0x10, ttl 64, id 23232, offset 0, flags [DF], proto TCP (6), length 103)
    xxx.xxx.xx.190.21 > xxx.xxx.xx.26.46471: Flags [P.], cksum 0xa3c1 (incorrect -> 0x6677), seq 2371:2422, ack 258, win 57, options [nop,nop,TS val 501698806 ecr 3675220555], length 51: FTP, length: 51
	227 Entering Passive Mode (46,255,165,190,14,105)
17:07:39.307805 IP (tos 0x0, ttl 63, id 51598, offset 0, flags [DF], proto TCP (6), length 60)
    xxx.xxx.xx.26.46471 > xxx.xxx.xx.190.21: Flags [P.], cksum 0x4bca (correct), seq 258:266, ack 2422, win 127, options [nop,nop,TS val 3675220576 ecr 501698806], length 8: FTP, length: 8
	LIST /
17:07:39.307906 IP (tos 0x8, ttl 63, id 36191, offset 0, flags [DF], proto TCP (6), length 60)
    xxx.xxx.xx.26.35717 > xxx.xxx.xx.190.3689: Flags [S], cksum 0x037b (correct), seq 2737745022, win 29200, options [mss 1460,sackOK,TS val 3675220576 ecr 0,nop,wscale 8], length 0
17:07:39.307931 IP (tos 0x0, ttl 64, id 0, offset 0, flags [DF], proto TCP (6), length 60)
    xxx.xxx.xx.190.3689 > xxx.xxx.xx.26.35717: Flags [S.], cksum 0x6d12 (correct), seq 669858040, ack 2737745023, win 14480, options [mss 1460,sackOK,TS val 501698827 ecr 3675220576,nop,wscale 8], length 0
17:07:39.308176 IP (tos 0x8, ttl 63, id 36192, offset 0, flags [DF], proto TCP (6), length 52)
    xxx.xxx.xx.26.35717 > xxx.xxx.xx.190.3689: Flags [.], cksum 0xd3fc (correct), ack 1, win 115, options [nop,nop,TS val 3675220576 ecr 501698827], length 0
17:07:39.308241 IP (tos 0x10, ttl 64, id 23233, offset 0, flags [DF], proto TCP (6), length 82)
    xxx.xxx.xx.190.21 > xxx.xxx.xx.26.46471: Flags [P.], cksum 0xa3ac (incorrect -> 0x31a1), seq 2422:2452, ack 266, win 57, options [nop,nop,TS val 501698827 ecr 3675220576], length 30: FTP, length: 30
	150 Accepted data connection
17:07:39.308357 IP (tos 0x8, ttl 64, id 27122, offset 0, flags [DF], proto TCP (6), length 1470)
    xxx.xxx.xx.190.3689 > xxx.xxx.xx.26.35717: Flags [P.], cksum 0xa918 (incorrect -> 0x7083), seq 1:1419, ack 1, win 57, options [nop,nop,TS val 501698827 ecr 3675220576], length 1418
17:07:39.308368 IP (tos 0x8, ttl 64, id 27123, offset 0, flags [DF], proto TCP (6), length 52)
    xxx.xxx.xx.190.3689 > xxx.xxx.xx.26.35717: Flags [F.], cksum 0xceab (correct), seq 1419, ack 1, win 57, options [nop,nop,TS val 501698827 ecr 3675220576], length 0
17:07:39.308383 IP (tos 0x10, ttl 64, id 23234, offset 0, flags [DF], proto TCP (6), length 95)
    xxx.xxx.xx.190.21 > xxx.xxx.xx.26.46471: Flags [P.], cksum 0xa3b9 (incorrect -> 0x91fc), seq 2452:2495, ack 266, win 57, options [nop,nop,TS val 501698827 ecr 3675220576], length 43: FTP, length: 43
	226-Options: -a -l 
	226 20 matches total
17:07:39.308607 IP (tos 0x8, ttl 63, id 36193, offset 0, flags [DF], proto TCP (6), length 52)
    xxx.xxx.xx.26.35717 > xxx.xxx.xx.190.3689: Flags [.], cksum 0xce67 (correct), ack 1419, win 126, options [nop,nop,TS val 3675220576 ecr 501698827], length 0
17:07:39.308647 IP (tos 0x0, ttl 63, id 51599, offset 0, flags [DF], proto TCP (6), length 52)
    xxx.xxx.xx.26.46471 > xxx.xxx.xx.190.21: Flags [.], cksum 0x184b (correct), ack 2495, win 127, options [nop,nop,TS val 3675220576 ecr 501698827], length 0
17:07:39.309235 IP (tos 0x8, ttl 63, id 36194, offset 0, flags [DF], proto TCP (6), length 52)
    xxx.xxx.xx.26.35717 > xxx.xxx.xx.190.3689: Flags [F.], cksum 0xce64 (correct), seq 1, ack 1420, win 126, options [nop,nop,TS val 3675220577 ecr 501698827], length 0
17:07:39.309252 IP (tos 0x8, ttl 64, id 27124, offset 0, flags [DF], proto TCP (6), length 52)
    xxx.xxx.xx.190.3689 > xxx.xxx.xx.26.35717: Flags [.], cksum 0xcea8 (correct), ack 2, win 57, options [nop,nop,TS val 501698828 ecr 3675220577], length 0
```


tcpdump output of the same request between the proxy (xxx.xxx.xx.26) and the client (xxx.xxx.xx.241) :
```tcpdump
17:07:39.323990 IP (tos 0x10, ttl 63, id 5636, offset 0, flags [DF], proto TCP (6), length 58)
    xxx.xxx.xx.241.54588 > xxx.xxx.xx.26.21: Flags [P.], cksum 0x9b24 (correct), seq 154:160, ack 1374, win 245, options [nop,nop,TS val 1638895935 ecr 3410322029], length 6: FTP, length: 6
	PASV
17:07:39.343033 IP (tos 0x0, ttl 64, id 17514, offset 0, flags [DF], proto TCP (6), length 104)
    xxx.xxx.xx.26.21 > xxx.xxx.xx.241.54588: Flags [P.], cksum 0x9e86 (incorrect -> 0x8c3c), seq 1374:1426, ack 160, win 114, options [nop,nop,TS val 3410326402 ecr 1638895935], length 52: FTP, length: 52
	227 Entering Passive Mode (195,144,11,26,165,149).
17:07:39.343822 IP (tos 0x0, ttl 63, id 13481, offset 0, flags [DF], proto TCP (6), length 60)
    xxx.xxx.xx.241.54747 > xxx.xxx.xx.26.42389: Flags [S], cksum 0x405a (correct), seq 1557277737, win 29200, options [mss 1460,sackOK,TS val 1638895955 ecr 0,nop,wscale 1], length 0
17:07:39.343866 IP (tos 0x8, ttl 64, id 0, offset 0, flags [DF], proto TCP (6), length 60)
    xxx.xxx.xx.26.42389 > xxx.xxx.xx.241.54747: Flags [S.], cksum 0x9e5a (incorrect -> 0x6059), seq 1298224302, ack 1557277738, win 28960, options [mss 1460,sackOK,TS val 3410326403 ecr 1638895955,nop,wscale 8], length 0
17:07:39.344443 IP (tos 0x0, ttl 63, id 13482, offset 0, flags [DF], proto TCP (6), length 52)
    xxx.xxx.xx.241.54747 > xxx.xxx.xx.26.42389: Flags [.], cksum 0xc73e (correct), ack 1, win 14600, options [nop,nop,TS val 1638895955 ecr 3410326403], length 0
17:07:39.344449 IP (tos 0x10, ttl 63, id 5637, offset 0, flags [DF], proto TCP (6), length 60)
    xxx.xxx.xx.241.54588 > xxx.xxx.xx.26.21: Flags [P.], cksum 0x6d8a (correct), seq 160:168, ack 1426, win 245, options [nop,nop,TS val 1638895955 ecr 3410326402], length 8: FTP, length: 8
	LIST /
17:07:39.345658 IP (tos 0x0, ttl 64, id 17515, offset 0, flags [DF], proto TCP (6), length 82)
    xxx.xxx.xx.26.21 > xxx.xxx.xx.241.54588: Flags [P.], cksum 0x9e70 (incorrect -> 0x53b0), seq 1426:1456, ack 168, win 114, options [nop,nop,TS val 3410326405 ecr 1638895955], length 30: FTP, length: 30
	150 Accepted data connection
17:07:39.346175 IP (tos 0x8, ttl 64, id 30094, offset 0, flags [DF], proto TCP (6), length 1470)
    xxx.xxx.xx.26.42389 > xxx.xxx.xx.241.54747: Flags [FP.], cksum 0xa3dc (incorrect -> 0x9c1e), seq 1:1419, ack 1, win 114, options [nop,nop,TS val 3410326405 ecr 1638895955], length 1418
17:07:39.346775 IP (tos 0x8, ttl 63, id 13483, offset 0, flags [DF], proto TCP (6), length 52)
    xxx.xxx.xx.241.54747 > xxx.xxx.xx.26.42389: Flags [.], cksum 0xbc06 (correct), ack 1420, win 16048, options [nop,nop,TS val 1638895958 ecr 3410326405], length 0
17:07:39.346778 IP (tos 0x8, ttl 63, id 13484, offset 0, flags [DF], proto TCP (6), length 52)
    xxx.xxx.xx.241.54747 > xxx.xxx.xx.26.42389: Flags [F.], cksum 0xbc05 (correct), seq 1, ack 1420, win 16048, options [nop,nop,TS val 1638895958 ecr 3410326405], length 0
17:07:39.346816 IP (tos 0x8, ttl 64, id 49463, offset 0, flags [DF], proto TCP (6), length 52)
    xxx.xxx.xx.26.42389 > xxx.xxx.xx.241.54747: Flags [.], cksum 0xfa42 (correct), ack 2, win 114, options [nop,nop,TS val 3410326406 ecr 1638895958], length 0
17:07:39.386533 IP (tos 0x10, ttl 63, id 5638, offset 0, flags [DF], proto TCP (6), length 52)
    xxx.xxx.xx.241.54588 > xxx.xxx.xx.26.21: Flags [.], cksum 0x3a1d (correct), ack 1456, win 245, options [nop,nop,TS val 1638895998 ecr 3410326405], length 0
17:07:42.349461 IP (tos 0x0, ttl 64, id 17516, offset 0, flags [DF], proto TCP (6), length 84)
    xxx.xxx.xx.26.21 > xxx.xxx.xx.241.54588: Flags [P.], cksum 0x9e72 (incorrect -> 0x6262), seq 1456:1488, ack 168, win 114, options [nop,nop,TS val 3410329408 ecr 1638895998], length 32: FTP, length: 32
	500 LIST: Connection timed out
17:07:42.350206 IP (tos 0x10, ttl 63, id 5639, offset 0, flags [DF], proto TCP (6), length 52)
    xxx.xxx.xx.241.54588 > xxx.xxx.xx.26.21: Flags [.], cksum 0x22af (correct), ack 1488, win 245, options [nop,nop,TS val 1638898961 ecr 3410329408], length 0
```

**Comment by jb-boin** [comment]
Tried with a ProFTPD 1.3.5 from Debian Jessie (1.3.5-1.1+deb8u2) and it works even worse as it seems that its triggering a bug on the backend.
The backend works fine if connecting directly from Filezilla or ncftp but not when connecting through the proxy.


### The backend bug :
After logging in using the infos from the database then asking to do a `LIST`, the backend sends `150 Opening BINARY mode data connection for file list` to the proxy then something goes wrong and it tries to retrieve infos for for UID 0 (which it shouldnt) using a generic query (that is also shouldnt be using as `SQLUserInfo` is set).

The SQL log file :
```
2018-09-24 15:56:07,536 mod_sql/4.3[44724]: connection 'default' successfully established
2018-09-24 15:56:07,536 mod_sql/4.3[44724]: mod_sql engine     : on
2018-09-24 15:56:07,536 mod_sql/4.3[44724]: negative_cache     : off
2018-09-24 15:56:07,536 mod_sql/4.3[44724]: authenticate       : users 
2018-09-24 15:56:07,536 mod_sql/4.3[44724]: usertable          : users
2018-09-24 15:56:07,536 mod_sql/4.3[44724]: userid field       : userid
2018-09-24 15:56:07,536 mod_sql/4.3[44724]: password field     : passwd
2018-09-24 15:56:07,536 mod_sql/4.3[44724]: UID field          : uid
2018-09-24 15:56:07,536 mod_sql/4.3[44724]: GID field          : gid
2018-09-24 15:56:07,536 mod_sql/4.3[44724]: homedir field      : homedir
2018-09-24 15:56:07,536 mod_sql/4.3[44724]: shell field        : shell
2018-09-24 15:56:07,536 mod_sql/4.3[44724]: SQLMinUserUID      : 33
2018-09-24 15:56:07,536 mod_sql/4.3[44724]: SQLMinUserGID      : 33
2018-09-24 15:56:07,536 mod_sql/4.3[44724]: <<< sql_sess_init
2018-09-24 15:56:07,542 mod_sql/4.3[44724]: >>> cmd_getpwnam
2018-09-24 15:56:07,544 mod_sql/4.3[44724]: cache miss for user 'testUser'
2018-09-24 15:56:07,544 mod_sql/4.3[44724]: >>> sql_lookup
2018-09-24 15:56:07,544 mod_sql/4.3[44724]: >>> process_named_query 'login'
2018-09-24 15:56:07,544 mod_sql/4.3[44724]: query "SELECT user, password AS passwd, '33' AS uid, '33' AS gid, pointage AS homedir, '/dev/null' AS shell FROM ftp WHERE user='testUser'"
2018-09-24 15:56:07,545 mod_sql/4.3[44724]: <<< process_named_query 'login'
2018-09-24 15:56:07,545 mod_sql/4.3[44724]: <<< sql_lookup
2018-09-24 15:56:07,545 mod_sql/4.3[44724]: custom SQLUserInfo query 'login' returned 6 columns for user 'testUser'
2018-09-24 15:56:07,545 mod_sql/4.3[44724]: cache miss for user 'testUser'
2018-09-24 15:56:07,545 mod_sql/4.3[44724]: user 'testUser' cached
2018-09-24 15:56:07,545 mod_sql/4.3[44724]: + pwd.pw_name  : testUser
2018-09-24 15:56:07,545 mod_sql/4.3[44724]: + pwd.pw_uid   : 33
2018-09-24 15:56:07,545 mod_sql/4.3[44724]: + pwd.pw_gid   : 33
2018-09-24 15:56:07,545 mod_sql/4.3[44724]: + pwd.pw_dir   : /path/to/user/home
2018-09-24 15:56:07,545 mod_sql/4.3[44724]: + pwd.pw_shell : /dev/null
2018-09-24 15:56:07,545 mod_sql/4.3[44724]: <<< cmd_getpwnam
2018-09-24 15:56:07,545 mod_sql/4.3[44724]: >>> sql_pre_pass
2018-09-24 15:56:07,545 mod_sql/4.3[44724]: <<< sql_pre_pass
2018-09-24 15:56:07,545 mod_sql/4.3[44724]: >>> cmd_getpwnam
2018-09-24 15:56:07,545 mod_sql/4.3[44724]: cache hit for user 'testUser'
2018-09-24 15:56:07,545 mod_sql/4.3[44724]: <<< cmd_getpwnam
2018-09-24 15:56:07,545 mod_sql/4.3[44724]: >>> cmd_auth
2018-09-24 15:56:07,545 mod_sql/4.3[44724]: cache hit for user 'testUser'
2018-09-24 15:56:07,545 mod_sql/4.3[44724]: >>> cmd_check
2018-09-24 15:56:07,545 mod_sql/4.3[44724]: checking password using SQLAuthType 'Crypt'
2018-09-24 15:56:07,549 mod_sql/4.3[44724]: 'Crypt' SQLAuthType handler reports success
2018-09-24 15:56:07,549 mod_sql/4.3[44724]: cache hit for user 'testUser'
2018-09-24 15:56:07,549 mod_sql/4.3[44724]: <<< cmd_check
2018-09-24 15:56:07,549 mod_sql/4.3[44724]: <<< cmd_auth
2018-09-24 15:56:07,549 mod_sql/4.3[44724]: >>> cmd_getpwnam
2018-09-24 15:56:07,549 mod_sql/4.3[44724]: cache hit for user 'testUser'
2018-09-24 15:56:07,549 mod_sql/4.3[44724]: <<< cmd_getpwnam
2018-09-24 15:56:07,582 mod_sql/4.3[44724]: >>> cmd_uid2name
2018-09-24 15:56:07,582 mod_sql/4.3[44724]: cache miss for UID '0'
2018-09-24 15:56:07,582 mod_sql/4.3[44724]: query "SELECT userid, passwd, uid, gid, homedir, shell FROM users WHERE (uid = 0) LIMIT 1"
2018-09-24 15:56:07,582 mod_sql/4.3[44724]: unrecoverable backend error
2018-09-24 15:56:07,582 mod_sql/4.3[44724]: error: '1142'
2018-09-24 15:56:07,583 mod_sql/4.3[44724]: message: 'SELECT command denied to user 'ftp'@'xxx.xxx.xx.190' for table 'users''
```
(the table `users` does not exists and is not defined anywhere on the configuration)


The backend interresting configuration parts are :
```
SQLNamedQuery login SELECT "user, password AS passwd, '33' AS uid, '33' AS gid, pointage AS homedir, '/dev/null' AS shell FROM ftp WHERE user='%U'"
SQLUserInfo custom:/login
SQLMinUserUID 33
SQLMinUserGID 33
SQLAuthTypes Crypt
SQLBackend	mysql
SQLEngine on
SQLAuthenticate users
```

### The proxy bug :
On the proxy side, the main difference with the previous tests with a PureFTPD as a backend is that the disconnection is immediate after the `LIST` (bug a `NLST -C` works just fine) and that there is one more error displayed on the trace.log of the proxy after the `read EOF on data connection` line :
```<proxy.ftp.ctrl:9>: error reading telnet data: Operation not permitted```

**Comment by jb-boin** [comment]
As a followup on the latest message, with a backend using ProFTPD, activating debug trace on DEFAULT along with mod_proxy, here are the different trace messages between a working query (`NLST -C /` or `MLSD /` for example) and a `LIST /` (timer, dns and netio messages have been excluded) :

### Working`MLSD /` :
```
2018-09-27 14:37:52,457 [4581] <proxy:17>: accepting connection from frontend client for passive data transfer for MLSD
2018-09-27 14:37:52,457 [4581] <inet:15>: enabled SO_KEEPALIVE on socket fd 17
2018-09-27 14:37:52,457 [4581] <proxy.ftp.conn:9>: accepted connection from server 'xxx.xxx.xx.241'
2018-09-27 14:37:52,458 [4581] <proxy:19>: handling data connection during data transfer
2018-09-27 14:37:52,459 [4581] <proxy.ftp.data:15>: received 1784 bytes of data
2018-09-27 14:37:52,459 [4581] <proxy:9>: received 1784 bytes of data from source data connection
2018-09-27 14:37:52,459 [4581] <proxy:19>: handling data connection during data transfer
2018-09-27 14:37:52,459 [4581] <proxy:19>: read EOF on data connection, closing frontend/backend data connections
2018-09-27 14:37:52,460 [4581] <event:8>: no event handlers registered for 'mod_proxy.ctrl-read'
2018-09-27 14:37:52,460 [4581] <proxy.ftp.ctrl:9>: received '226 Transfer complete' response from backend to frontend
2018-09-27 14:37:52,460 [4581] <proxy.ftp.ctrl:9>: backend->frontend response: 226 Transfer complete
2018-09-27 14:37:52,460 [4581] <response:1>: 226 Transfer complete
```

### Failing `LIST /` :
```
2018-09-27 14:37:59,892 [4581] <proxy:17>: accepting connection from frontend client for passive data transfer for LIST
2018-09-27 14:37:59,892 [4581] <inet:15>: enabled SO_KEEPALIVE on socket fd 17
2018-09-27 14:37:59,892 [4581] <proxy.ftp.conn:9>: accepted connection from server 'xxx.xxx.xx.241'
2018-09-27 14:37:59,893 [4581] <proxy:19>: handling data connection during data transfer
2018-09-27 14:37:59,893 [4581] <proxy:19>: read EOF on data connection, closing frontend/backend data connections
2018-09-27 14:37:59,894 [4581] <netio:7>: read 0 bytes from control stream fd 15, handling as EOF
2018-09-27 14:37:59,894 [4581] <proxy.ftp.ctrl:9>: error reading telnet data: Operation not permitted
```

**Comment by Castaglia** [comment]
@jb-boin Can you provide the `proftpd -V` output, and the full `proftpd.conf` you're using?  It sounds like there are some other configurations, in addition to the `mod_proxy` configuration, that are affecting things for you.  I'm hoping that, by using the same configuration, I can reproduce this behavior locally.

**Comment by jb-boin** [comment]
I am sorry, i unfortunately don't have the files i did the tests with anymore.

**Comment by richardjkendall** [comment]
@Castaglia I've been able to reproduce a similar issue with the only difference being compiling for 64bit or 32bit.  I'm compiling for ARM, when I compile on AWS graviton2 is okay, when I compile for ARMv7 I get this issue.  I want to use on raspberry pi hence compiling for ARMv7.

It's worth noting that I get the same results when I run the 32bit code on a 64bit processor.  I've also compiled a 32bit version (inside docker) on my 64bit machine and got the same outcome.

My **proftpd.conf** is the same in both circumstances:

```
ScoreboardFile /var/proftpd/proftpd.scoreboard

LoadModule mod_proxy.c

<IfModule mod_proxy.c>
        ProxyEngine on
        ProxyLog /var/log/ftpproxy.log
        ProxyTables /var/ftp/proxy

        ProxyRole reverse
        ProxyReverseConnectPolicy LeastConns
        ProxyDataTransferPolicy EPSV
	ProxyReverseServers ftp://<backend>:10021 
</IfModule>
```

My backend is a python app server running pyftpdlib.

**proftpd -V on armv7**

```
Compile-time Settings:
  Version: 1.3.7a (maint)
  Platform: LINUX [Linux 4.9.35-v7+ armv7l]
  Built: Mon Sep 28 2020 04:18:58 UTC
  Built With:
    configure  '--enable-dso' '--with-shared=mod_proxy'

  CFLAGS: -g2 -O2 -Wall -fno-omit-frame-pointer -Werror=implicit-function-declaration
  LDFLAGS: -L$(top_srcdir)/lib -L$(top_builddir)/lib  -rdynamic 
  LIBS:  -lsupp -lresolv -lresolv -lcrypt 

  Files:
    Configuration File:
      /usr/local/etc/proftpd.conf
    Pid File:
      /usr/local/var/proftpd.pid
    Scoreboard File:
      /usr/local/var/proftpd.scoreboard
    Header Directory:
      /usr/local/include/proftpd
    Shared Module Directory:
      /usr/local/libexec

  Info:
    + Max supported UID: 4294967295
    + Max supported GID: 4294967295

  Features:
    - Autoshadow support
    - Controls support
    - curses support
    - Developer support
    + DSO support
    + IPv6 support
    + Largefile support
    - Lastlog support
    - Memcache support
    - ncurses support
    - NLS support
    - OpenSSL support
    - PCRE support
    - POSIX ACL support
    - Redis support
    + Sendfile support
    + Shadow file support
    - Sodium support
    + Trace support
    + xattr support

  Tunable Options:
    PR_TUNABLE_BUFFER_SIZE = 1024
    PR_TUNABLE_DEFAULT_RCVBUFSZ = 8192
    PR_TUNABLE_DEFAULT_SNDBUFSZ = 8192
    PR_TUNABLE_ENV_MAX = 2048
    PR_TUNABLE_GLOBBING_MAX_MATCHES = 100000
    PR_TUNABLE_GLOBBING_MAX_RECURSION = 8
    PR_TUNABLE_HASH_TABLE_SIZE = 40
    PR_TUNABLE_LOGIN_MAX = 256
    PR_TUNABLE_NEW_POOL_SIZE = 512
    PR_TUNABLE_PATH_MAX = 4096
    PR_TUNABLE_SCOREBOARD_BUFFER_SIZE = 80
    PR_TUNABLE_SCOREBOARD_SCRUB_TIMER = 30
    PR_TUNABLE_SELECT_TIMEOUT = 30
    PR_TUNABLE_TIMEOUTIDENT = 10
    PR_TUNABLE_TIMEOUTIDLE = 600
    PR_TUNABLE_TIMEOUTLINGER = 10
    PR_TUNABLE_TIMEOUTLOGIN = 300
    PR_TUNABLE_TIMEOUTNOXFER = 300
    PR_TUNABLE_TIMEOUTSTALLED = 3600
    PR_TUNABLE_XFER_SCOREBOARD_UPDATES = 10
```

**proftpd -V on arm64**

```
Compile-time Settings:
  Version: 1.3.7a (maint)
  Platform: LINUX [Linux 5.4.0-1025-aws aarch64]
  Built: Wed Sep 23 2020 10:12:06 UTC
  Built With:
    configure  '--enable-dso' '--with-shared=mod_proxy'

  CFLAGS: -g2 -O2 -Wall -fno-omit-frame-pointer -Werror=implicit-function-declaration
  LDFLAGS: -L$(top_srcdir)/lib -L$(top_builddir)/lib  -rdynamic 
  LIBS:  -lsupp -lnsl -lresolv -lresolv -lcrypt -ldl 

  Files:
    Configuration File:
      /usr/local/etc/proftpd.conf
    Pid File:
      /usr/local/var/proftpd.pid
    Scoreboard File:
      /usr/local/var/proftpd.scoreboard
    Header Directory:
      /usr/local/include/proftpd
    Shared Module Directory:
      /usr/local/libexec

  Info:
    + Max supported UID: 4294967295
    + Max supported GID: 4294967295

  Features:
    - Autoshadow support
    - Controls support
    - curses support
    - Developer support
    + DSO support
    + IPv6 support
    + Largefile support
    - Lastlog support
    - Memcache support
    - ncurses support
    - NLS support
    - OpenSSL support
    - PCRE support
    - POSIX ACL support
    - Redis support
    + Sendfile support
    + Shadow file support
    - Sodium support
    + Trace support
    + xattr support

  Tunable Options:
    PR_TUNABLE_BUFFER_SIZE = 1024
    PR_TUNABLE_DEFAULT_RCVBUFSZ = 8192
    PR_TUNABLE_DEFAULT_SNDBUFSZ = 8192
    PR_TUNABLE_ENV_MAX = 2048
    PR_TUNABLE_GLOBBING_MAX_MATCHES = 100000
    PR_TUNABLE_GLOBBING_MAX_RECURSION = 8
    PR_TUNABLE_HASH_TABLE_SIZE = 40
    PR_TUNABLE_LOGIN_MAX = 256
    PR_TUNABLE_NEW_POOL_SIZE = 512
    PR_TUNABLE_PATH_MAX = 4096
    PR_TUNABLE_SCOREBOARD_BUFFER_SIZE = 80
    PR_TUNABLE_SCOREBOARD_SCRUB_TIMER = 30
    PR_TUNABLE_SELECT_TIMEOUT = 30
    PR_TUNABLE_TIMEOUTIDENT = 10
    PR_TUNABLE_TIMEOUTIDLE = 600
    PR_TUNABLE_TIMEOUTLINGER = 10
    PR_TUNABLE_TIMEOUTLOGIN = 300
    PR_TUNABLE_TIMEOUTNOXFER = 300
    PR_TUNABLE_TIMEOUTSTALLED = 3600
    PR_TUNABLE_XFER_SCOREBOARD_UPDATES = 10
```

**Comment by Castaglia** [comment]
I know it's been a while, but I finally got around to looking into this issue again.  And  using a local Docker Compose setup, with a pure-ftpd backend, I'm able to reproduce this behavior locally (using the latest ProFTPD, mod_proxy code).  So I should now be able to make progress on addressing this.

**Comment by Castaglia** [comment]
Interestingly, with this fix (now merged), I think we may no longer need the `ProxyTimeoutLinger` directive.  I'll consider removing that directive later.

**Comment by richardjkendall** [comment]
Thanks @Castaglia - I'm going to test this in the next couple of days.

I really appreciate you getting to this :)

**Comment by e-fik123** [comment]
Hi @Castaglia i am now experiencing this issue, i have compiled ProFTPd:
proftpd -V
Compile-time Settings:
  Version: 1.3.9rc1 (devel)
  Platform: LINUX [Linux 5.15.0-89-generic x86_64]
  OS/Release:
    PRETTY_NAME="Ubuntu 22.04.3 LTS"
    NAME="Ubuntu"
    VERSION_ID="22.04"
    VERSION="22.04.3 LTS (Jammy Jellyfish)"
    VERSION_CODENAME=jammy
    ID=ubuntu
    ID_LIKE=debian
    UBUNTU_CODENAME=jammy
  Built: Tue Dec 5 2023 14:01:30 CET
  Built With:
    configure  '--with-includes=/usr/include/openssl:/usr/include:/usr/local/src/proftpd/contrib:/usr/local/src/proftpd/contrib/mod_proxy/include:/usr/include/mysql' '--sysconfdir=/etc/proftpd' '--with-libraries=/usr/lib/ssl:/usr/lib/x86_64-linux-gnu/:/usr/local/src/proftpd/contrib/mod_proxy/lib' '--enable-openssl' '--with-modules=mod_sql:mod_sql_mysql:mod_tls:mod_sftp:mod_proxy:mod_rewrite:mod_ban:mod_dynmasq:mod_wrap:mod_wrap2:mod_wrap2_file:mod_wrap2_sql:mod_ifsession:mod_shaper:mod_ctrls_admin:mod_unique_id:mod_site_misc:mod_load:mod_sftp_sql' '--enable-dso' '--enable-ctrls'

  CFLAGS: -g2 -O2 -Wall -fno-omit-frame-pointer -fno-strict-aliasing
  LDFLAGS: -Wl,-L$(top_srcdir)/lib,-L$(top_builddir)/lib  -rdynamic -L/usr/local/src/proftpd/contrib/mod_proxy/lib -L/usr/lib/x86_64-linux-gnu/ -L/usr/lib/ssl -L/usr/lib/x86_64-linux-gnu
  LIBS:  -lssl -lcrypto -lwrap -lnsl  -lsqlite3  -lssl  -lm -lmysqlclient -lz  -lcrypto -lcrypt  -pthread

  Files:
    Configuration File:
      /etc/proftpd/proftpd.conf
    Pid File:
      /usr/local/var/proftpd.pid
    Scoreboard File:
      /usr/local/var/proftpd.scoreboard
    Header Directory:
      /usr/local/include/proftpd
    Shared Module Directory:
      /usr/local/libexec

  Info:
    + Max supported UID: 4294967295
    + Max supported GID: 4294967295

  Features:
    - Autoshadow support
    + Controls support
    - curses support
    - Developer support
    + DSO support
    + IPv6 support
    + Largefile support
    - Lastlog support
    - Memcache support
    - ncurses support
    - NLS support
    + OpenSSL support (OpenSSL 3.0.2 15 Mar 2022)
    - PCRE support
    - PCRE2 support
    - POSIX ACL support
    - Redis support
    + Sendfile support
    + Shadow file support
    - Sodium support
    + Trace support
    + xattr support

  Tunable Options:
    PR_TUNABLE_BUFFER_SIZE = 1024
    PR_TUNABLE_DEFAULT_RCVBUFSZ = 65536
    PR_TUNABLE_DEFAULT_SNDBUFSZ = 65536
    PR_TUNABLE_ENV_MAX = 2048
    PR_TUNABLE_GLOBBING_MAX_MATCHES = 100000
    PR_TUNABLE_GLOBBING_MAX_RECURSION = 8
    PR_TUNABLE_HASH_TABLE_SIZE = 40
    PR_TUNABLE_LOGIN_MAX = 256
    PR_TUNABLE_NEW_POOL_SIZE = 512
    PR_TUNABLE_PATH_MAX = 4096
    PR_TUNABLE_SCOREBOARD_BUFFER_SIZE = 80
    PR_TUNABLE_SCOREBOARD_SCRUB_TIMER = 30
    PR_TUNABLE_SELECT_TIMEOUT = 30
    PR_TUNABLE_TIMEOUTIDENT = 10
    PR_TUNABLE_TIMEOUTIDLE = 600
    PR_TUNABLE_TIMEOUTLINGER = 10
    PR_TUNABLE_TIMEOUTLOGIN = 300
    PR_TUNABLE_TIMEOUTNOXFER = 300
    PR_TUNABLE_TIMEOUTSTALLED = 3600
    PR_TUNABLE_XFER_SCOREBOARD_UPDATES = 10


with the latest mod_proxy

- the backend FTp servers are: ProFTPd: 1.3.5 and also 1.3.9rc1

Command:      	MLSD
Answer: 	150 Opening BINARY mode data connection for MLSD
Error:     	Can not connect: ETIMEDOUT - Connection try exceeded timout limit

Any help is more then welcome.

Thank you

**Comment by Castaglia** [comment]
@e-fik123 Could you open a separate new ticket for the issues you're seeing, please?  It's easiest for me to use separate tickets for tracking separate issues over time.  Thanks!

**Comment by e-fik123** [comment]
ok i will
